label,data
1,"as its 23 horrifying days of flesheating come to an end , the creeper has embarked on its final voracious feeding frenzy in poho county . "
0,"highlighted by a gritty style and an excellent cast , it's better than one might expect when you look at the list of movies starring ice-t in a major role . "
1,"tension mounts , and as the cops arrive , morgan is growing impatient . "
0,"[janey] forgets about her other obligations , leading to a tragedy which is somehow guessable from the first few minutes , maybe because it echoes the by now intolerable morbidity of so many recent movies . "
1,"but with tess's wedding coming on saturday , the two have to find a way to switch back - and fast . "
0,"it's not a great monster movie . but if you've paid a matinee price and bought a big tub of popcorn , there's guilty fun to be had here . chomp chomp ! "
1,"impressed by his extravagant lifestyle and prowess , his young son kilo yearns to follow in his footsteps . "
1,chris forces mitchell to deliver guns and drugs while he hangs out on a rooftop and freaks out all day . 
0,the movie suffers from two fatal ailments -- a dearth of vitality and a story that's shapeless and uninflected . 
0,"although estela bravo's documentary is cloyingly hagiographic in its portrait of cuban leader fidel castro , it's still a guilty pleasure to watch . "
1,he wants to realize the dream nurtured for year by his father . 
0,a little more intensity and a little less charm would have saved this film a world of hurt . 
0,"this is a film well worth seeing , talking and singing heads and all . "
0,"if festival in cannes nails hard- boiled hollywood argot with a bracingly nasty accuracy , much about the film , including some of its casting , is frustratingly unconvincing . "
1,"her recent divorce has left her with terminal writer's block and extremely depressed , and her best friend , patti , is beginning to think she might never recover . "
1,"soon , disease spread , robbing people's abilities to speak ; the endless rain killing all other forms of communication with its acidic torrent . "
1,his dreams seemingly become shattered as caroline is married and has a daughter . 
0,"aloof and lacks any real raw emotion , which is fatal for a film that relies on personal relationships . "
1,"joe hickley thinks he's got a great scheme : kidnap the child of rich parents , hold it for 24 hours , keeping the mother under his control while an accomplice gets the ransom from the father , who is on a trip . "
1,"pitted against steroid-taking competitors and the biggest sports-nutrition company in the world , he is up against odds and enemies who want to destroy him . "
1,the entire town begins to look for ellen when she fails to appear at home that night . 
0,you can sip your vintage wines and watch your merchant ivory productions ; i'll settle for a nice cool glass of iced tea and a jerry bruckheimer flick any day of the week . 
1,"they follow him to las vegas , where he is ostensibly doing "" research "" for the next season , but is actually pursuing a dream to become a dancer in a vegas show . "
1,"he is going to sweden , and invites lilja to come along and start a new life . "
0,"the writers , director wally wolodarsky , and all the actors should start their own coeducational fraternity : kappa rho alpha phi . "
1,"a documentary which revolves around a shelter for battered women in tampa , florida . "
1,"she feels left out from her father's new family , she's had an abortion , she's tried to commit suicide , and she hates life in the city . "
0,a hypnotic cyber hymn and a cruel story of youth culture . 
0,"such a good-looking picture deserved to have more depth and unpredictability in its story . but it does stand out as a personal and unique entry in a time-worn genre , and that may be good enough . "
0,has the rare capability to soothe and break your heart with a single stroke . 
0,"there's not a spark of new inspiration in it , just more of the same , done with noticeably less energy and imagination . "
1,"however , ruby's encounters suffer from impotence and unexplained rashes . "
0,"despite cramming in numerous clichés , mehta still manages to put a fresh and funny spin on the proceedings . "
1,"their only solid lead seems to be joanne , a young prostitute , whose own baby provides a link . "
1,"jonathan ecks ( antonio banderas ) , an fbi agent , realizes that he must join with his lifelong enemy , agent sever ( lucy liu ) , a rogue dia agent with whom he is in mortal combat , in order to defeat a common enemy . "
0,"waydowntown may not be an important movie , or even a good one , but it provides a nice change of mindless pace in collision with the hot oscar season currently underway . "
1,the da sends the dupe into valento-land in hopes of getting the sociopath off his back . 
1,"louis has something hilary desperately needs , and hilary has something louis cannot live without . "
0,"good for a few unintentional laughs , "" extreme ops "" was obviously made for the "" xxx "" crowd , people who enjoy mindless action without the benefit of decent acting , writing , and direction . "
0,"the movie has lots of dancing and fabulous music . there are slow and repetitive parts , but it has just enough spice to keep it interesting . "
1,"unbeknownst to the elders , the widows daughter has come to settle the estate , evict them and have an estate sale all in one day . "
0,"it's like a "" big chill "" reunion of the baader-meinhof gang , only these guys are more harmless pranksters than political activists . "
0,suffers from a flat script and a low budget . 
1,"the friends may listen , but when do they learn , maybe never or only when the journey begins with you ! . "
0,i have two words to say about reign of fire . great dragons ! 
1,mayhem and comedy explode as several members find price attractive while price struggles for his sanity . 
1,"when johnny and lena are stumped , they turn to wayne . . . but "
1,"reluctantly , busy katherine allows patricia to audition and , at once , recognizes her incredible talent . "
1,"a young french journalist , marina , is writing a report on 'the next film starred by melina : the story of lilly' . "
0,"sluggishly directed by episodic tv veteran joe zwick , it's a sitcom without the snap-crackle . "
1,he is under the impression that rupi is dead . 
1,"touted as an unofficial sequel to his 1989 hit sex , lies , and videotape , this arty film-within-a-film ( which was shot in just 18 days ) revolves around seven people with little in common whose lives collide . "
0,upper west sidey exercise in narcissism and self-congratulation disguised as a tribute . 
0,"self-congratulatory , misguided , and ill-informed , if nonetheless compulsively watchable . "
1,young cop kong yat hong ( karen mok ) and her partner mark are put on the case . 
0,"while tattoo borrows heavily from both seven and the silence of the lambs , it manages to maintain both a level of sophisticated intrigue and human-scale characters that suck the audience in . "
1,everyone thinks that it's him that has opened the chamber of secrets because that is what slytherin was famous for . 
0,"this starts off with a 1950's doris day feel and it gets very ugly , very fast . the first five minutes will have you talking 'til the end of the year ! "
1,"months on , marie finds herself alone , life having taken a dramatic turn . "
1,"the case gets more complicated , when even the police themselves appear to become suspects in the murders . "
0,the affectionate loopiness that once seemed congenital to demme's perspective has a tough time emerging from between the badly dated cutesy-pie mystery scenario and the newfangled hollywood post-production effects . 
0,"for the most part , the film does hold up pretty well . "
0,a well-made and often lovely depiction of the mysteries of friendship . 
1,he has been with his girlfriend for 9 months too long . 
1,"now , along with other surviors , jill valentine , claire redfield and carlos oliviera , they must fight to survive , to escape the nightmare that has plauged raccoon city . "
1,arjun is already the number one person on several men&#180 ; s hit lists and must overcome this and everything he encounters on his hunt . 
0," . . . a ho-hum affair , always watchable yet hardly memorable . "
1,"this unique short film follows the night of a young british insomniac named jack , narrated almost hour by hour from a first hand perspective . "
1,"the two choose a piano from his possessions , which comes to represent the couple's relationship as he pushes the piano 50 blocks across the city to their home . "
1,"as he returns to moscow he finds a new world ruled by underworld bosses , criminal clans fighting each other and utter chaos on the desperately keeping appearances streets of russian capital . "
1,divan follows the filmmaker's effort to retrieve a turn-of-the-century family heir loom - a couch . 
1,"desperate , neurotic gloria goes on an emotional roller coaster ride when her boyfriend of three and a half weeks , kip sends her yellow roses . "
1,"it's an instant success for simon , he meets the delightful mia who immediately takes a liking to him . "
1,"after having christmas present and rent money stolen by someone posing as santa , they get jobs working as unarmed security guards in the local mall , they get threatened with eviction , pick up girls , get drunk , take drugs and need quick cash . "
0,"this is not a retread of "" dead poets' society . "" "
1,"watch as superfag rescues anthony , a naive , adorably cute guy whom superfag falls head over heals in love with . . . watch "
1,"as a young teenager , he finds out who his father is . "
1,"amber ( madonna ) is 40 , beautiful , rich , spoiled , and arrogant beyond measure . "
0,"between bedroom scenes , viewers may find themselves wishing they could roll over and take a nap . "
0,the embodiment of the very message it so modestly conveys -- it's the accomplished little guy we fervently root for . 
0,"could use a little more humanity , but it never lacks in eye-popping visuals . "
1,"they all collide during the course of a typical no thrills weekend an urban fairy tale-romantic comedy , in which nola , an aspiring songwriter , leaves an abusive kansas home and journeys to new york to find her biological father . "
0,"stripped almost entirely of such tools as nudity , profanity and violence , labute does manage to make a few points about modern man and his problematic quest for human connection . "
1,for once the kids don't let sam down - and they're not likely to forget the lessons they've learned . 
0,"there is a fine psychological thriller about divided loyalties and ambiguous identities buried with all the rubble and the maimed bodies , and mr . han and ms . kim play their slightly absurd roles with brisk sincerity"
0,"equilibrium the movie , as opposed to the manifesto , is really , really stupid . "
0,ice age posits a heretofore unfathomable question : is it possible for computer-generated characters to go through the motions ? 
1,"with some help from otis and the paddy wagon's quirky regulars , among them an angry war vet in a parrot costume and a traveling salesman with a "" small "" problem , mark finally gets what he deserves . "
0,"purely propaganda , a work of unabashed hero worship , it is nonetheless -- and likely inadvertently -- a timely and invaluable implicit reminder of the role that u . s . foreign policy has played in the rise of castro . "
0,"carrying this wafer-thin movie on his nimble shoulders , chan wades through putrid writing , direction and timing with a smile that says , 'if i stay positive , maybe i can channel one of my greatest pictures , drunken master . '"
0,"confessions isn't always coherent , but it's sharply comic and surprisingly touching , so hold the gong . "
0,photographed with melancholy richness and eloquently performed yet also decidedly uncinematic . 
0,will anyone who isn't a fangoria subscriber be excited that it hasn't gone straight to video ? 
0,[villeneuve] seems to realize intuitively that even morality is reduced to an option by the ultimate mysteries of life and death . 
0,"in scope , ambition and accomplishment , children of the century . . . takes kurys' career to a whole new level . "
1,"the fake "" attack "" turns into a bloodbath . "
1,the two are catapulted into the chase of their lifetimes in pursuit of the kidnapped professor and the lost temple . 
1,"sent to a german stalag prison camp , lieutenant hart is at once thrust into the social order of pows , where every man thinks of himself first with bribery and trading with german captors commonplace . "
0,"about schmidt is undoubtedly one of the finest films of the year . if you're not deeply touched by this movie , check your pulse . "
1,"tom twyker ( director of 'run lola run' ) helms this kieslowski tale about love , retribution and redemption . "
0,"needless to say , the dramatics that follow are utter hooey . "
0,"reminiscent of david mamet's elaborate screen bluffs -- only livelier , more playful . "
0,"anchored by a terrific performance by abbass , satin rouge shows that the idea of women's self-actualization knows few continental divides . "
1,"his first challenge is from the chinese workers , technicians , and officers , who have been trained to work under the old system and unable to function sufficiently in the new era of international competition . "
1,"at the agency , instead of mr . right , laura meets miguel , who has all the signs of mr . wrong : he's a blue-collar , unpolished simple man . "
0,"a photographic marvel of sorts , and it's certainly an invaluable record of that special fishy community . "
0,"the kind of history lesson that you wouldn't mind seeing again and again , no matter the format . "
1,"it concludes with a laramie staging of "" angels in america "" a year after shephard's death . "
1,"when the apocalypse arrives , it takes the form of a bio-chemical virus , contaminating the cities , mountains , and shorelines . "
0,hawke draws out the best from his large cast in beautifully articulated portrayals that are subtle and so expressive they can sustain the poetic flights in burdette's dialogue . 
0,"it downplays the initial assault , referring to it only in fragmented flashbacks , while offering a cogent critique of ongoing attitudes about rape and its victims , particularly in japan . "
0, . . . manages to deliver a fair bit of vampire fun . 
0,"by turns pretentious , fascinating , ludicrous , provocative and vainglorious . "
0,the moviegoing equivalent of going to a dinner party and being forced to watch the host and hostess's home video of their baby's birth . 
1,"then , in 1974 , something incredible happened - they fell in love . "
0,it collapses when mr . taylor tries to shift the tone to a thriller's rush . 
1,they call themselves d . e . b . s . 
0,offers a gentle summer fantasy for both grown-ups and little ones . 
1,he has been detained there as a result of planted incriminating evidence of unlawful investigation techniques . 
0,the film has the courage of its convictions and excellent performances on its side . 
0,"it sounds sick and twisted , but the miracle of shainberg's film is that it truly is romance"
0," "" one look at a girl in tight pants and big tits and you turn stupid ? "" um . . isn't that the basis for the entire plot ? "
0,"pan nalin's exposition is beautiful and mysterious , and the interviews that follow , with the practitioners of this ancient indian practice , are as subtle and as enigmatic . "
0,"it's bright , pristine style and bold colors make it as much fun as reading an oversized picture book before bedtime . "
1,"the body bears strange marks on the chest which may or may not be the sign of a sin eater ( furmann ) , a renegade who offers absolution , last rites and therefore a path to heaven outside the jurisdiction of the church . "
0,"miyazaki's nonstop images are so stunning , and his imagination so vivid , that the only possible complaint you could have about spirited away is that there is no rest period , no timeout . "
0,a psychologically rich and suspenseful moral thriller with a stellar performance by al pacino . 
1,"she wants his blessing to marry a man she loves , but he tells her that she must marry a man of his choosing , and that she must undergo female circumcision . "
1,"they renege , but a legitimate kidney becomes available for transplant . "
1,"sam marks his last day in the battleground of public education by getting saddled with the detention class after hours , playing warden to a pack of rebellious students , the worst troublemakers in school . "
0,"go for la salle's performance , and make do as best you can with a stuttering script . "
1,"these movies were the first adult movies , most of them were made in order to explain how sex works to unexperimented young men before their first relation with a prostitute . . . "
0,"as expected , sayles' smart wordplay and clever plot contrivances are as sharp as ever , though they may be overshadowed by some strong performances . "
0,"so mind-numbingly awful that you hope britney won't do it one more time , as far as movies are concerned . "
0,"an 83 minute document of a project which started in a muddle , seesawed back and forth between controlling interests multiple times , then found its sweet spot"
1,"his father , aglanar , was happy at his birth that he would have a strong and honorable son to carry on the traditions of the valley . "
1,this eruption of bloody violence becomes the catalyst for the unleashing of dark forces with terrifying results . 
1,the war of the ring has now begun . . . 
1,yeh kaisi mohabbat ( ykm ) is a romantic thriller . 
1," "" sumo east and west "" takes us into this world through the story of wayne vierra of hawaii , aka kamakiiwa , a former professional sumo wrestler in japan whose pro career was cut short by injury , but who rebounded to become a champion in the growing world of amateur sumo . "
1,"clarissa vaughn , a modern woman living in present times is throwing a party for her friend richard , a famous author dying of aids . "
0,"tavernier shows us , in more ways than one , that le ciné ma de qualité lives on . "
1,she has been programmed to eliminate other cybernetic organisms . 
1,"in the end family , good friends , and a supportive community rally to help him once again find joy . "
0,there's no denying the physically spectacular qualities of the film . . . or the emotional integrity of the performances . 
1,chris takes mitchell to an abandoned rooftop and threatens him and his mother . 
0,"while sunshine state lacks the searing urgency of city of hope or the gentle dénouement of lone star , fans of the auteur should enjoy this classic john sayles feature . "
1,"in a generation of individuals , they struggle to choose love . "
0,one of the most splendid entertainments to emerge from the french film industry in years . 
0,"for devotees of french cinema , safe conduct is so rich with period minutiae it's like dying and going to celluloid heaven . "
1,"when the switchblade , the most sophisticated prototype stealth fighter created yet , is stolen from the u . s . government , one of the united states' top spies , alex scott ( owen wilson ) , is called to action . "
1,"the hilarity belies the poignancy of truth and love and the laughter is punctuated with honesty , tenderness and pain . "
0,"it ain't art , by a long shot , but unlike last year's lame musketeer , this dumas adaptation entertains . "
0,a must see for all sides of the political spectrum
0,the actors are forced to grapple with hazy motivations that never come into focus . 
1,tong is sent back to fetch some things for devlin and unknowingly tries on devlin's tuxedo and finds that it gives extraordinary powers to anyone that dons the suit . 
1,and that's what you get when sampling the wonderful idiosyncrasies in this love story on espresso . 
0,"a boring masquerade ball where normally good actors , even kingsley , are made to look bad . "
1,this is the story of some of those who left . 
1,"anna must make a decision about honoring her father's wishes to go to italy and learn about her heritage , while her three friends each search for the perfect relationship . . . "
1,"stitch as the new family member brings quite some action into all their lifes , and after a while , not even pleakley and dr . jookiba can recognize their former target . "
0,"the people in dogtown and z-boys are so funny , aggressive and alive , you have to watch them because you can't wait to see what they do next . "
1,"nick , a district attorney investigating the most recent case , a suspicious apparent suicide , and her interviews with friends and family of the deceased trigger extensive and intricately interwoven flashbacks that reveal surprising facts about the man's life and death . "
1,"already living in a society that mistrusts them , the mutants are faced with even more discrimination after an unforeseen enemy - who may be a mutant with extraordinary powers - launches a devastating attack . "
1,a team of experts must return back in time and replace the butterfly . 
0,"the film belongs to the marvelous verdu , a sexy slip of an earth mother who mourns her tragedies in private and embraces life in public"
1,"the sister kills herself when she finds out there is no money to pay for her transplant , and while he is burying her body near the stream they used to play in , the daughter accidentally drowns . "
0,a crackerjack genre piece ; what panic room aims for it accomplishes with deadly precision and edge-of-your-seat mastery . 
1,"as the strange thefts escalate , detective phil barbara ( gale harold ) is assigned to the case and is soon on chep and fran's trail . "
1,"keeping her mind diligently focused on dance proves harder than she expected as she finds herself falling in love with david schrader , a dark and mysterious new york musician . "
0,noyce films it more as a shocking history lesson than as drama . 
1,"before he can do anything about it , though , jed is seduced by jackson's lesbian artist friend . "
1,"but just when james starts to question his role and his cat-and-mouse relationship with his mentor , burke taps him for a special assignment to root out a mole . "
0,"if you're willing to have fun with it , you won't feel cheated by the high infidelity of unfaithful . "
0,it certainly won't win any awards in the plot department but it sets out with no pretensions and delivers big time . 
0,the plan to make enough into an inspiring tale of survival wrapped in the heart-pounding suspense of a stylish psychological thriller' has flopped as surely as a soufflé gone wrong . 
1,"a virus has scaped in a secret facility called "" the hive "" turning all researchers into hungry zombies and releasing their mutated lab "" animals "" that they were studying . "
0,"É uma pena que , mais tarde , o próprio filme abandone o tom de paródia e passe a utilizar os mesmos clichês que havia satirizado . "
1,when the skittish emma finds blood on her pillow why does she still stay behind ? 
0,"dialogue-heavy and too cerebral for its own good -- or , at any rate , too cerebral for its racy subject matter . "
0,"shiner can certainly go the distance , but isn't world championship material"
1,"rumours of haunting , paired with the desire to forget the painful tragedy that took place five years before , have kept the truth of holy angel's last days buried with the innocent victims . "
1,"with his own group , the urban cyber breakers , he has got a dream : to win the dance battle that will bring his team to the world final in new york before reaching usa and fame , he has to overcome the rival group , the ld , to deal with his mother's excessive love and to live out his passion for the beautiful samia . "
1,"in order get loan sharks off his back , he must finish his novel in 30 days or wind up dead . "
1,from that moment on nothing is as it was before . . . 
0,"filmmakers who can deftly change moods are treasures and even marvels . so , too , is this comedy about mild culture clashing in today's new delhi . "
1,"an edgy indie-psychological drama about an alluring but mixed-up l . a . girl who flip-flops between facing life's uncertainty under her own direction or "" the good life "" provided by a wealthy , disturbing middle-aged benefactor . "
1,"after he's dumped on valentine's day by mallory , his girlfriend of three years , charlie finds himself obsessed and unable to live a normal life without her . "
0,"fresh and raw like a blown-out vein , narc takes a walking-dead , cop-flick subgenre and beats new life into it . "
1,syd does accept him and befriends him and shows him how to live . 
0,a decided lack of spontaneity in its execution and a dearth of real poignancy in its epiphanies . 
0,"it's shocking , intense , and totally creepy , yet compelling and sad . jeremy renner gives a career-making performance . "
0,"a haunted , bountiful film that demands patience -- and rewards it . "
1,"thinking the young man is dead , a curious fisherman with a scalpel finds two bullets in his back and a miniature laser device in his hip . "
0,majidi's direction has never been smoother or more confident . 
0,"french director helene angel's dark but deftly handled fable about familial violence has a terrifying , fairy-tale atmosphere that's in perfect keeping with its unique point of view . "
0,"comes off more like a misdemeanor , a flat , unconvincing drama that never catches fire . "
1,"nobody chooses to come here , this where they end up . "
0,an old-fashioned but emotionally stirring adventure tale of the kind they rarely make anymore . 
0,"bursting through the constraints of its source , this is one adapted- from-television movie that actually looks as if it belongs on the big screen . "
