label,data
1,"when she is discovered stealing money from the hotel , she turns to her friend zidanes for help . "
1,all of this changes when he finds a large mysterious package left on his doorstep . 
1,"through his addiction to these ardent visions , he becomes more reclusive . "
1,"now , all the mutants need to fight together against an enemy in common : general william stryker , who is planning to destroy them all . "
0,"a gracious , eloquent film that by its end offers a ray of hope to the refugees able to look ahead and resist living in a past forever lost . "
1,"he is to build the palace and be covered in gold , if not , his fate is to be eaten by crocodiles . "
0,there are some wonderfully fresh moments that smooth the moral stiffness with human kindness and hopefulness . 
0,"tartakovsky's team has some freakish powers of visual charm , but the five writers slip into the modern rut of narrative banality . "
0,this is an exercise not in biography but in hero worship . 
1,many years have passed since the secret knight avenged his family by slaying the evil knight . 
1,"bobby quickly learns however , that smith is no regular john , and their meeting has unintended consequences that neither of them is prepared to afford . "
1,"but when he discovers an odd wristwatch amidst his father's various inventions and slips it on , something very strange happens . "
0,too many improbabilities and rose-colored situations temper what could've been an impacting film . 
0,borrows from other movies like it in the most ordinary and obvious fashion . 
1,"but instead of broadway or movies , her appearances have been limited to industrials and infomercials . "
0,"the santa clause 2 "" goes down as easy as an eggnog on christmas eve . "
1,"he's in the southwest , headed toward mexico , when he picks up bennie , a woman leaving an abusive marriage , going to paradise , arizona . "
0,miller comes at film with bracing intelligence and a vision both painterly and literary . 
1,"2 . a cranny , hollow , or crevice , as in a rock . "
1,"he finds a level of comfort in his old skin , and is able to finally get some sleep . "
1,"amongst these , ruth , a girl of 17 , writes a diary on the journey they are to undertake on the atlantic . "
1,"with david carradine , theo van gogh , kate clarke and henry jaglom - featuring a soundtrack by grammy nominated composer willie wisely , who also plays the lead character , willie vincent . "
0,"chilling but uncommercial look into the mind of jeffrey dahmer , serial killer . "
1,"michael , an obessive compulsive real estate dealer who enjoys "" the younger set . "" "
1,"one day , lilja falls in love with andrej . "
1,but how can graham really fall in love with her when he sees each time as the first time ? 
1,"she sets out to strike down her once fellow assassins , leaving bill for last . "
0,ferrara's strongest and most touching movie of recent years . 
1,"he can remember nothing and begins to try to rebuild his memory based on clues such as the swiss bank account , the number of which , is implanted in his hip . "
0,"the trinity assembly approaches the endeavor with a shocking lack of irony , and george ratliff's documentary , hell house , reflects their earnestness  which makes for a terrifying film . "
0,"one-sided documentary offers simplistic explanations to a very complex situation . . . . stylistically , the movie is a disaster . "
1,"on an african safari , eliza thornberry discovers that thanks to a shaman , she can now talk to animals . "
0,hands down the year's most thought-provoking film . but it pays a price for its intricate intellectual gamesmanship . 
0,"herzog , a man of detail became enraptured with his subject and was unable to use his editing shears . "
1,"but , sometimes what we teach our children can be as deadly as not teaching them . "
0," "" 13 conversations about one thing "" is an intelligent flick that examines many different ideas from happiness to guilt in an intriguing bit of storytelling . "
1,his intricate paintings of the devil and his elaborate journal entries depicting encounters with him led sigmund freud to diagnose him as one of the first known schizophrenics . 
0,ranks among the best films ever made about the acting profession . 
1,"a dramatic thriller about a emerald smuggler who has 5 days to go to rio , finish off a deal with a brazilian drug lord and find his lost daughter , unknown to him from an affair 15 years earlier . "
0,"ringu is a disaster of a story , full of holes and completely lacking in chills . ignore the reputation , and ignore the film . "
0,"a tender and touching drama , based on the true story of a troubled african-american's quest to come to terms with his origins , reveals the yearning we all have in our hearts for acceptance within the family circle . "
1,"when a powerful developer named mr . scheck wants to knock down all the stores and houses in arnold's neighborhood to build a huge "" mall-plex "" , it looks likes the neighborhood is doomed to disappear . "
1,"when zidanes refuses , christin decides to fake a suicide attempt , hoping budcasso will take pity on her . "
1,"semi-improvised on the streets of liverpool , dan reed's drama brings the true face of britain's underworld to light . "
1,"as things become increasingly more complicated in the small community , the walls around father amaro begin to crumble . "
1,"boromir ( sean bean ) is dead , frodo baggins ( elijah wood ) and samwise gamgee ( sean astin ) have gone to mordor alone to destroy the one ring , merry ( dominic monaghan ) and pippin ( billy boyd ) have been captured by the uruk-hai , and aragorn ( viggo mortensen ) , legolas ( orlando bloom ) , and gimli ( john rhys-davies ) have made friends of the rohan , a race of humans that are in the path of the upcoming war , led by its aging king , th&#233 ; oden ( bernard hill ) . "
1,"steve quickly discovers that burt cannot even provide temporary lodging , but an administrator at his new high school directs him to a shelter for runaway kids where he soon learns to navigate his way . "
0, . . . a mostly boring affair with a confusing sudden finale that's likely to irk viewers . 
0,this dreadfully earnest inversion of the concubine love triangle eschews the previous film's historical panorama and roiling pathos for bug-eyed mugging and gay-niche condescension . 
1,"the pursuit eventually takes us back to l . a . , where secrets begin to get exposed . . . . "
0,nothing but an episode of smackdown ! in period costume and with a bigger budget . 
1,"when his father decides that it's time for tough love , he doesn't pay his tuition . "
0,"for those who are intrigued by politics of the '70s , the film is every bit as fascinating as it is flawed . "
1,wishing to free himself more firmly he locks himself into d&#233 ; pendance and lack of power . 
0,"this time out , [sade] is an unsettlingly familiar figure -- in turns loyal and deceitful , responsible and reckless , idealistically selfless and coldly self-interested . "
0,"writhing under dialogue like 'you're from two different worlds' and 'tonight the maid is a lie and this , this is who you are , ' this schlock-filled fairy tale hits new depths of unoriginality and predictability . "
1,a love story played out against a backdrop of political and religious upheaval . 
1,"in the process , quinn discovers secrets from his past and battles with the inner demons that made him the man he is today . "
1," "" tattered angel "" is a story of pain and triumph . "
1,louis is a struggling painter whose life is turned upside down when his wish comes true and he becomes trapped in his own paintings . 
0,the cast is top-notch and i predict there will be plenty of female audience members drooling over michael idemoto as michael . 
0,the film starts out as competent but unremarkable . . . and gradually grows into something of considerable power . 
0,"zhuangzhuang creates delicate balance of style , text , and subtext that's so simple and precise that anything discordant would topple the balance , but against all odds , nothing does . "
0,sam mendes has become valedictorian at the school for soft landings and easy ways out . 
1,"anna changes her mind : when some rich , ignorant american couple wondering about if they should buy the house asks for the swimming pool ( while the mediterranean is half a mile away ) , she simply doubles the charge , and finally puts the "" for sale "" plate into the garbage can . "
0,"kids who are into this thornberry stuff will probably be in wedgie heaven . anyone else who may , for whatever reason , be thinking about going to see this movie is hereby given fair warning . "
0,"harmon opts to show less and suggest more , and the script's gloomy downer of an ending is audacious . "
1,"but idle curiosity leads to a dark secret when rebecca and john cam with vera madeline , an online psychic , who initiates a deadly reign of terror over their lives . "
0,a moving portrait of a man who has lost his place in the world . 
1,"once convicted , he ends up on death row in texas himself , telling his story to a reporter through a series of flashbacks . "
0," . . . only bond can save us from the latest eccentric , super-wealthy megalomaniac bent on world domination and destruction . "
1,"after john anderton lost his son to a crime a six years ago , he took up drugs , and works the precog division like nobody else . "
0,"this sade is hardly a perverse , dangerous libertine and agitator -- which would have made for better drama . he's just a sad aristocrat in tattered finery , and the film seems as deflated as he does . "
1,"on the case , he soon deducts that the killer , who staged the murder to look like a random robbery , may actually be a serial killer terry was trailing for years in the fbi . "
0," sandra bullock and hugh grant make a great team , but this predictable romantic comedy should get a pink slip . "
0,"even when foreign directors . . . borrow stuff from hollywood , they invariably shake up the formula and make it more interesting . "
1,"based on brett easton ellis's novel , the story deals with a drug dealer at a vermont school , who becomes entangled in a love triangle with a girl whom he likes , but he sleeps with her roommate , and a guy who has a crush on him . "
1,"guilt leads him to try to cover it up in the week before the wedding , high jinks ensue . "
0,"to the film's credit , the acting is fresh and unselfconscious , and munch is a marvel of reality versus sappy sentiment . "
1,"puzzled , he turns for help from a private cyber detective . "
0,"this amiable picture talks tough , but it's all bluster -- in the end it's as sweet as greenfingers . . . "
0,"the real reason to see runteldat is to watch lawrence deploy his deep and wide powers of empathy to depict such diverse experiences as childbirth , breast-feeding and recovering from illness . "
0,"it's mildly amusing , but i certainly can't recommend it . "
1,little do they know but help is on the way and this friday will get freaky ! 
0,the obligatory break-ups and hook-ups don't seem to have much emotional impact on the characters . 
1,"they literally bump heads one night , and become best friends . "
0,"it further declares its director , zhang yang of shower , as a boldly experimental , contemporary stylist with a bright future . "
1,"leoncio's son robert and daughter marites disapprove of their father's single-handed decision , leading to a conflict that causes the old man's fatal heart attack . "
1,"chock full of ethnic flavor , whimsy , doubt , faith , joy and wonder , mary and joe is a delightful surprise , as the old story is brought into the present with startling freshness and power . "
1,"setting accounts with shaman - a big criminal boss , who ordered the evidence planted and also with his former colleagues was not a part of korenev's agenda . "
0,this isn't a good movie ; this isn't a bad movie . this is a movie that dispenses with the whole good/bad paradigm and exists on its own plane of reality . 
0,"whatever eyre's failings as a dramatist , he deserves credit for bringing audiences into this hard and bitter place . "
1,"in the last days of the second world war , an american administrative lieutenant is captured by german forces during the battle of the bulge . "
1,stryker puts into motion a plan to eradicate the mutants and begins an offensive on the x-men mansion and school . 
0,an incoherent jumble of a film that's rarely as entertaining as it could have been . 
0,the charms of the lead performances allow us to forget most of the film's problems . 
0,"portentous and pretentious , the weight of water is appropriately titled , given the heavy-handedness of it drama . "
1,"with the help of another innocent prisoner ( richard harris ) , he escapes the island and proceeds to transform himself into the wealthy count of monte cristo as part of his plan to exact revenge . "
0, . . . a good film that must have baffled the folks in the marketing department . 
0,"when the precise nature of matthew's predicament finally comes into sharp focus , the revelation fails to justify the build-up . "
0,"an exhaustive investigation into the roots and after-effects of the revolutions and counter-revolutions that rocked france , the u . s . , china , latin america and czechoslovakia in 1967 and 1968 . "
1,she went on to be in brazil's first-ever fashion parade/show . 
0,"the lightest , most breezy movie steven spielberg has made in more than a decade . and the positive change in tone here seems to have recharged him . "
1,"paralyzed by the discovery he is only capable of leaving with a stupid excuse , trying to hide from ana the anguish that barely lets him breath . "
1,"no one else , that is , until an extra-ordinary group of six outlaws lands on their front porch . "
0,"static , repetitive , muddy and blurry , hey arnold ! would seem to have a lock on the title of ugliest movie of the year . "
1,"three mischevious employees ( paulo costanzo , woody harrelson , alicia silverstone ) of a bank in a small deserted town all make plans to rob at the same time , however none of them knows about the others . "
1,"they are soon caught up in the erotic nature of the chat sessions they host , changing both their lives . "
0,"doesn't deliver a great story , nor is the action as gripping as in past seagal films . "
1,tells the humorous and touching story of six former creative anarchists who lived as house squatters in berlin during its heyday in the 80s when berlin was still an island in the middle of the former eastern germany . 
0,this mistaken-identity picture is so film-culture referential that the final product is a ghost . 
1,"through his grandmother's boundless patience and devotion , he learns to embrace empathy , humility and the importance of family . "
0,"britney's performance cannot be faulted . lucy's a dull girl , that's all . "
1,this appears to be only the beginning of a string of suicides around the country . 
1,"her mother's friends , who formed a secret society , the ya-ya sisterhood , as children , kidnap siddalee from her new york apartment and take her home to louisiana , where they explain why her mother mistreated her with help from the secret ya-ya scrapbook ( and copious flashbacks ) . "
1,"this movie shows the intense life of this character ; not only focusing in the robberies , but also in the reasons that pushed him into acting the way he did . "
0,"as an exercise in stripped-down filmmaking , interview is grimly effective . "
1,"unbeknownst to her , the real scoop is much more awesome then even she could write about , should she live to tell . "
0,a different movie -- sometimes tedious -- by a director many viewers would like to skip but film buffs should get to know . 
0,"it has something of the aura of four weddings and a funeral about it , mixed in with a bit of bridget jones's diary , but the movie's just too different , too risky for huge popularity . "
0,"a film that presents an interesting , even sexy premise then ruins itself with too many contrivances and goofy situations . "
1,"but they're also so much more , as you'll find out in deborah dickson's powerful and intimate documentary . "
0,"so infectious , so colorful , so exhilarating , that you almost forget that at its core , it's merely a curry-inflected remake of father of the bride , with snippets of other films thrown in . "
0,hawn lets it all hang out in this film and i have to admire her guts . sarandon is equally bold and daring in her portrayal of a woman who has lost her way in a closet full of beige suits . 
1,"so , shaun goes to great lengths with a little help from his girlfriend ashley and his drugged-out loser brother lance to get into stanford any way they see fit . "
0,"though an important political documentary , this does not really make the case the kissinger should be tried as a war criminal . "
1,"an apparent gynaecologist dr . nightingale hastily marries a pregnant patient , modesta and takes her home to his mysterious manor to meet mother . "
1,"he has become an inconvenient obstacle to his work-a-holic son , and lost all remaining freedoms , except the valued time he spends with his grandson . "
0,"no better or worse than 'truth or consequences , n . m . ' or any other interchangeable actioner with imbecilic mafia toolbags botching a routine assignment in a western backwater . "
1,"produced by chica luna productions , corporate dawgz is a comedic ode to white revolutionaries who understand that what they give up in privilege they gain tenfold in humanity . "
1,"suddenly , a young boy starts to become ill and starts to suffer from the same syndromes that regan from the fist movie suffered . "
1,is the albino stalking her or watching over her ? 
0,claude miller airs out a tight plot with an easy pace and a focus on character drama over crime-film complications . 
1,"she hits her head badly , and dies in the hospital a little later . "
1,"from stag beetle to swastika narrates in a richly detailed , associative montage the boundless possibilities of manipulating images and using images the historionaut , a history machine , produces an incessant stream of remembered , contemporary and future images . "
0,"[shyamalan] turns the goose-pimple genre on its empty head and fills it with spirit , purpose and emotionally bruised characters who add up to more than body count . "
0,director charles stone iii applies more detail to the film's music than to the story line ; what's best about drumline is its energy . 
1,it is a journey that will take both carol and charlie to the edge of reality and force carol to face up to her terrifying destiny . 
0," . . . while certainly clever in spots , this too-long , spoofy update of shakespeare's macbeth doesn't sustain a high enough level of invention . "
0,this is a film living far too much in its own head . 
1,"the fortune-teller's mentally retarded nephew , who comes to hear the prophesy , follows the girl . "
0,why spend $9 on the same stuff you can get for a buck or so in that greasy little vidgame pit in the theater lobby ? 
0,"the movie obviously seeks to re-create the excitement of such '50s flicks as jules verne's '20 , 000 leagues under the sea' and the george pal version of h . g . wells' 'the time machine . ' but its storytelling prowess and special effects are both listless . "
1,"set in hounslow , west london and hamburg , the film follows two 18 year olds with their hearts set on a future in professional soccer . "
1,"the guilt that he feels has altered his sense of reality , making matt's life a mystery full of shadows and phantoms . "
1,"jason must get back , therefore he gets a new and unique mask , and goes after the kids of elm street . "
1,"for anni they are not enemies , but just men . "
1,"following the gruesome murder of a young woman in her neighborhood , a self-determined woman living in new york city--as if to test the limits of her own safety--propels herself into an impossibly risky sexual liaison . "
0,it's deep-sixed by a compulsion to catalog every bodily fluids gag in there's something about mary and devise a parallel clone-gag . 
1,"he is at a loss to describe what he may have seen to the police , to ellen's mother , to himself . "
0,"involving at times , but lapses quite casually into the absurd . "
1,"refusing at first to open up , the young man eventually breaks down and reveals a horrific childhood . "
0,"shanghai ghetto may not be as dramatic as roman polanski's the pianist , but its compassionate spirit soars every bit as high . "
0,"gosling creates a staggeringly compelling character , a young man whose sharp intellect is at the very root of his contradictory , self-hating , self-destructive ways . "
1,soon the evil boss learns about sienna's affair with kilabot and kidnaps her to exact revenge . 
1,"oscar's path to his true love is further crossed by diane , eve's best friend who , one night while wearing eve's borrowed perfumed scarf , offers him temporary comfort in an unconventional tryst . "
0,"there's undeniable enjoyment to be had from films crammed with movie references , but the fun wears thin -- then out -- when there's nothing else happening . "
1,"a lowly thug , gigli ( ben affleck ) , is assigned to kidnap the psychologically challenged younger brother of a powerful federal prosecutor to save his mobster boss from incarceration . "
1,"for too long the children have been abused , molested , neglected , exploited , and killed , and their tormentors have escaped through the cracks in the justice system . "
0,"all of the elements are in place for a great film noir , but director george hickenlooper's approach to the material is too upbeat . "
0,"while cherish doesn't completely survive its tonal transformation from dark comedy to suspense thriller , it's got just enough charm and appealing character quirks to forgive that still serious problem . "
0,"like mike is a winner for kids , and no doubt a winner for lil bow wow , who can now add movies to the list of things he does well . "
0,"the camera soars above the globe in dazzling panoramic shots that make the most of the large-screen format , before swooping down on a string of exotic locales , scooping the whole world up in a joyous communal festival of rhythm . "
0,"skins has a desolate air , but eyre , a native american raised by white parents , manages to infuse the rocky path to sibling reconciliation with flashes of warmth and gentle humor . "
1,"to help things out , lena hires boey , an expert on babies , to join the team . "
1,the judge gives him until the end of the day to present the papers and thus begins a cat and mouse game between the proponents . 
1,"and it seems that the only thing that he can't do , is alter a person's free will , so if he wants her back , he has to do it the hard way . "
0,"smith examines the intimate , unguarded moments of folks who live in unusual homes -- which pop up in nearly every corner of the country . "
1,"the making of the dragon emphasizes and exaggerates all the overly dramatic moments , simplistic storylines and farcical elements that make up the films of the kung-fu genre . "
0,"sensitive , insightful and beautifully rendered film . one of the best of the year . "
1,she wants justice and will do anything to get it . 
0,"light the candles , bring out the cake and don't fret about the calories because there's precious little substance in birthday girl -- it's simply , and surprisingly , a nice , light treat . "
0,"every individual will see the movie through the prism of his or her own beliefs and prejudices , but the one thing most will take away is the sense that peace is possible . that , in itself , is extraordinary . "
1,"but sam decker still has a few tricks to teach the kids , and he's got some thingfs to learn from them . "
1,"set 10 years after the events in "" the phantom menace "" . "
0,to imagine the life of harry potter as a martial arts adventure told by a lobotomized woody allen is to have some idea of the fate that lies in store for moviegoers lured to the mediocrity that is kung pow : enter the fist . 
0,"may not have generated many sparks , but with his affection for astoria and its people he has given his tale a warm glow . "
1,"francis , an exceptional artist whose imaginative forays into a fictional universe of good and evil fill his notebooks with comic-book imagery , creates a netherworld of superhero alter egos for the two boys . "
1,"the next day , cac&#225 ; is attacked by two street kids who wanted some money , and thinks pqd is somehow involved . "
1,"igby slocumb , a rebellious and sarcastic seventeen year-old boy , is at war with the oppressive world of his east coast "" old money "" family . "
1,"struggling to fit in , jonathan decides to stop going to church only to be pursued by the members of the local singles ward who want to reactivate him . "
1,"this comedy , based on steve martin's successful stage play concerns a fictional meeting between a young pablo picasso and a young albert einstein at a paris cafe at the turn of the 20th century . "
1,jenny must fight to earn her scholarship and try to find a balance between the man of her faith and the man of her dreams . 
0,it all comes down to whether you can tolerate leon barlow . i can't . 
1,there are two distince paths in life good vs . evil . 
0,"as broad and cartoonish as the screenplay is , there is an accuracy of observation in the work of the director , frank novak , that keeps the film grounded in an undeniable social realism . "
1,things get a little awkward when harry suffers a heart attack at the home of marin's mother erica ( keaton ) . 
1,this includes punishment for delivering a baby in the prison cell while all of the prison staff has taken shelter during an iraqi bombing . 
1,"it's her millionaire boss , george wade ( hugh grant ) . "
