label,data
1,"the film , a follow-up to "" jack the dog "" , is described as a black comedy about a reformed womanizer ( nestor carbonell ) who struggles to keep his family together . "
1,"trapped in a lovers triangle and ruthless game of lust , greed , and betrayal we follow one woman's hypnotic journey to discover her true self . . . "
0,"84 minutes of rolling musical back beat and supercharged cartoon warfare . it's also , clearly , great fun . "
0,"with rare birds , as with the shipping news before it , an attempt is made to transplant a hollywood star into newfoundland's wild soil -- and the rock once again resists the intrusion . "
1,she'll just have to remember everything for the both of them . 
1,"he reluctantly agrees to protect a child , pinta balletto ( fanning ) , whose parents are threatened by a rash of kidnappings . "
0,stone seems to have a knack for wrapping the theater in a cold blanket of urban desperation . 
0,"schnieder bounces around with limp wrists , wearing tight tummy tops and hip huggers , twirling his hair on his finger and assuming that's enough to sustain laughs . . . "
1,"centers on an american ex-soldier ( washington ) living out his days in naples , italy . "
0,"even if it ultimately disappoints , the picture does have about a matinee admission's worth of funny to keep it afloat . "
1,during the course of the story we follow our hero as he attempts to single-handedly save the country from falling into the hands of a despot . 
0,robinson's web of suspense matches the page-turning frenzy that clancy creates . 
1,"later he is catering at a party featuring a wise old guru , who gets drunk and passes out . "
0,an ironic speculation on democracy in a culture unaccustomed to it . 
0,"a film full of vivid characters , quiet beauty and gentle grace . "
0,manages to please its intended audience -- children -- without placing their parents in a coma-like state . 
0,a work that lacks both a purpose and a strong pulse . 
0,"borrows a bit from the classics "" wait until dark "" and "" extremities "" . . . but in terms of its style , the movie is in a class by itself . "
1,"faced with a $10 million lawsuit , the department agrees to let producer chase renzi film mitch's investigation for a new reality tv show , and constantly tries to make everything more "" viewer friendly "" by changing everything about mitch's life to fit the stereotypical view of police officers--and partners him with trey . "
0,so original in its base concept that you cannot help but get caught up . 
0,"all the performances are top notch and , once you get through the accents , all or nothing becomes an emotional , though still positive , wrench of a sit . "
0,a wonderfully speculative character study that made up for its rather slow beginning by drawing me into the picture . 
1,"the gripping story of the dutch bettien martens , based on true facts . "
0,"technically , the film is about as interesting as an insurance commercial . "
0,jonathan parker's bartleby should have been the be-all-end-all of the modern-office anomie films . 
1,"clearly in over his head with both assignments , landon is forced to ask jamie for help . "
0,i'd watch these two together again in a new york minute . 
1,"however , finch also has a dilemma when , after wise words from stifler , stifler's mom and stifler's dad ( played by tim allen ) decide to renew their vows , and get married again . "
0,"a vivid reminder of the true nature of chemistry between lovers , and the rarity with which we see it on the screen . "
0,"not for everyone , but for those with whom it will connect , it's a nice departure from standard moviegoing fare . "
0,"davis' candid , archly funny and deeply authentic take on intimate relationships comes to fruition in her sophomore effort . "
1,the taxi driver is a serial killer who picks up innocent women but not all of his victims are as innocent as he thinks . 
0,read my lips is to be viewed and treasured for its extraordinary intelligence and originality as well as its lyrical variations on the game of love . 
1,"styled after vh1's "" behind the music , "" this mockumentary profiles the rise and fall of an internet startup , called icevan . com . "
1,the only threat mastermind thief charlie croker ( wahlberg ) never saw coming was a member of his own crew . 
0,"it's mildly sentimental , unabashedly consumerist . . . studiously inoffensive and completely disposable . "
0,"we never truly come to care about the main characters and whether or not they'll wind up together , and michele's spiritual quest is neither amusing nor dramatic enough to sustain interest . "
0,automatically pegs itself for the straight-to-video sci-fi rental shelf . 
1,"this film tells the true story of fraudulent washington , d . c . journalist stephen glass ( christensen ) , who rose to meteoric heights as a young writer in his 20s , becoming a staff writer at "" the new republic "" for three years ( 1995-1998 ) , where 27 of his 41 published stories were either partially or completely made up . "
0,"if you saw it on tv , you'd probably turn it off , convinced that you had already seen that movie . "
0,"it's a setup so easy it borders on facile , but keeping the film from cheap-shot mediocrity is its crack cast . "
0,with the prospect of films like kangaroo jack about to burst across america's winter movie screens it's a pleasure to have a film like the hours as an alternative . 
0,"a triumph , a film that hews out a world and carries us effortlessly from darkness to light . "
0,"a series of escapades demonstrating the adage that what is good for the goose is also good for the gander , some of which occasionally amuses but none of which amounts to much of a story . "
1,"back in france , werner recovers a taste for life and adrien returns to his solitary lifestyle . "
0,i'd be lying if i said my ribcage didn't ache by the end of kung pow . 
1,"when investigative reporter , chase somete and her team are on a trail of uncovering this organized fight ring , suk is torn between protecting the only family he knows , and defending the person who can bring him down . "
0,"the movie is a desperate miscalculation . it gives poor dana carvey nothing to do that is really funny , and then expects us to laugh because he acts so goofy all the time . "
1,"mi yun and kang have difficulty working with each other , as their personalities and working methods are constantly in conflict . "
1,18 years ago joe ( travolta ) had a chance to make his dream come true of directing his first movie in hollywood . 
0,is it possible for a documentary to be utterly entranced by its subject and still show virtually no understanding of it ? 
0,harmless entertainment for kids and just smart enough to appeal to parents . 
0,"for those who like quirky , slightly strange french films , this is a must ! "
1,it is left to the inept johnny english ( rowan atkinson ) to try and solve who has stolen the crown jewels from the tower of london . 
1,"but this time , lucy , instead of thinking of herself first is able to comfort dante and forgive his momentary rage . "
0,a byzantine melodrama that stimulates the higher brain functions as well as the libido . 
0,uneven but ultimately appealing satire of the dreck we call white man's rap music . some good performances and an often goofy script make for a generally good time . 
1,"deep in the northwest , there is a lone ranch tucked away so purposefully , the only way to find it is by not looking . "
1,"after confidential ( and shameful ) information was released by british authorities , this amazing story of survival was finally confirmed . "
0,the only surprise is that heavyweights joel silver and robert zemeckis agreed to produce this ; i assume the director has pictures of them cavorting in ladies' underwear . 
0,a straight-shooting family film which awards animals the respect they've rarely been given . 
1,kilo is now a free man and a new father with a drug franchise covering both coasts . 
1,"this includes never-before-seen images of tests of modified v-1s at point mugu naval air station , and the flight test program for regulus at edwards air force base in 1950 . "
0," "" i blame all men for war , "" [the warden's daughter] tells her father . the movie is about as deep as that sentiment . "
1,"convinced that peter is tracking her , she turns to them for help . "
0,"if you love the music , and i do , its hard to imagine having more fun watching a documentary . . . "
0,"pumpkin takes an admirable look at the hypocrisy of political correctness , but it does so with such an uneven tone that you never know when humor ends and tragedy begins . "
1,"realizing they are facing a tough adversary , lynn and sue become fascinated with hong as well . "
1,"whether it's the fbi swooping in to rescue us in mississippi burning or a fearless teacher storming a "" ghetto "" school to prove our youth can learn as in dangerous minds , we are often offended by such cinematic myths that are more interested in appeasing white liberal sensibilities than raising complex questions about what whites must truly sacrifice if they are sincere about ending racial injustice . "
1,her short visit awakens a romance that cannot go outside the island . 
0,"as directed by dani kouyate of burkina faso , sia lacks visual flair . but kouyate elicits strong performances from his cast , and he delivers a powerful commentary on how governments lie , no matter who runs them . "
1,a sexy urban comedy about how a guy who is addicted to watching pornography discovers love is stronger than fantasy when he meets and falls in love with the girl of his dreams . 
0,the film's most improbable feat ? it didn't go straight to video . 
1,he has to walk through some of the worst areas in l . a . 
1,"when petty thief cosimo ( luis guzman ) is given the plan for the perfect heist from a lifer in prison - the kind of job you dream about - he has to get out of jail , fast . "
0,"if deuces wild had been tweaked up a notch it would have become a camp adventure , one of those movies that's so bad it starts to become good . but it wasn't . "
0,"little more than a stylish exercise in revisionism whose point . . . is no doubt true , but serves as a rather thin moral to such a knowing fable . "
1,"he stands at the window and struggles to understand why his mother will not stop smoking , even after being diagnosed with emphysema . "
0,"what soured me on the santa clause 2 was that santa bumps up against 21st century reality so hard , it's icky . "
0,the only entertainment you'll derive from this choppy and sloppy affair will be from unintentional giggles  several of them . 
0,"attal's hang-ups surrounding infidelity are so old-fashioned and , dare i say , outdated , it's a wonder that he couldn't have brought something fresher to the proceedings simply by accident . "
0,"if this dud had been made in the '70s , it would have been called the hills have antlers and played for about three weeks in drive-ins . "
1,"many have no physical sex lives , living instead in a world of romance with stars like james dean or audrey hepburn . "
0,"i was hoping that it would be sleazy and fun , but it was neither . "
0,"while holm is terrific as both men and hjejle quite appealing , the film fails to make the most out of the intriguing premise . "
1,"however , when a search sets in , the people of dogville demand a better deal in exchange for the risk of harbouring poor grace and she learns the hard way that in this town , goodness is relative . "
0,"it's a smart , solid , kinetically-charged spy flick worthy of a couple hours of summertime and a bucket of popcorn . nothing overly original , mind you , but solidly entertaining . "
1,is this challenge too much for even the amazing spider-man to handle ? 
1,"suk , a korean martial artist , brought up by the organization since early childhood , is the man they trust to fight these 'special' matches . "
0,"a good-natured ensemble comedy that tries hard to make the most of a bumper cast , but never quite gets off the ground . "
0,the documentary makes no waves and tries to be as upbeat as the musicians it tells about . 
0,the sort of movie that gives tastelessness a bad rap . 
1,"meanwhile , una makes herself being fired in the supermarket . "
1,"in these times of enlightened sexual politics , ted davis is a scoring machine . "
1,"an ambitious , young female journalist , with an insatiable curiosity for getting to the bottom of the story , is having a torrid affair with a married man . "
0,"rarely do films come along that are as intelligent , exuberant , and moving as monsoon wedding . "
1,"dr . david gale , an advocate of eliminating the death penalty , is falsely accused of rape and murder . "
1,"in california , texas , and several other states , conservative politicians successfully waged legislative campaigns to outlaw and prohibit the sale , ownership or use of vibrators and dildos while simultaneously criminalizing other 'deviant' sexual practices . "
1,"we find elvis ( bruce campbell ) as an elderly resident in an east texas rest home , who switched identities with an elvis impersonator years before his "" death "" , then missed his chance to switch back . "
0,"there's an uneasy balance between the comedy and the drama that doesn't really fire on all levels , but it works on a few of them . "
0,a soap-opera quality twist in the last 20 minutes . . . almost puts the kibosh on what is otherwise a sumptuous work of b-movie imagination . 
0,"visually engrossing , seldom hammy , honorably mexican and burns its kahlories with conviction . "
1,"in a classic homage to chinese martial arts films , he is involved in intense hand to hand combat including sword fighting , guns , car chases , and other ingenious forms of fighting to mame and kill these tong members . "
1,"when the mercenaries catch up , sam , jake and the rest of their entourage find themselves in the clutches of the blood thirsty gallo . "
0,"while certainly more naturalistic than its australian counterpart , amari's film falls short in building the drama of lilia's journey . "
0,a cheerful enough but imminently forgettable rip-off of [besson's] earlier work . 
0,this is standard crime drama fare . . . instantly forgettable and thoroughly dull . 
1,"in awe of seductive club singer velma kelly ( who is subsequantly arrested for the murder of her husband and sister - after discovering their affair ) , roxie meets fred cassely a man who convinces her he can 'make her showbiz career take off' . "
0,"the journey to the secret's eventual discovery is a separate adventure , and thrill enough . "
0,"a tough go , but leigh's depth and rigor , and his skill at inspiring accomplished portrayals that are all the more impressive for their lack of showiness , offsets to a notable degree the film's often-mined and despairing milieu . "
0,a middlebrow hybrid that should satisfy most fans of spy movies without blowing them away . 
1,"life , love , and the fear of failing . . . "
0,"there are a few chuckles , but not a single gag sequence that really scores , and the stars seem to be in two different movies . "
1,"making matters worse , vince is having trouble discerning reality from memory . "
0,"the film would have been more enjoyable had the balance shifted in favor of water-bound action over the land-based 'drama , ' but the emphasis on the latter leaves blue crush waterlogged . "
1,"diego , one of the tigers that attacked the humans , comes also claiming the baby . "
1,the farmer whom the barn belongs to is distraught and can't cope from the intruder's power of articulations . 
0,"while general audiences might not come away with a greater knowledge of the facts of cuban music , they'll be treated to an impressive and highly entertaining celebration of its sounds . "
1,"they detour from their trip to take the girl to the nearest town , where they meet the local sheriff who is hell bent on capturing the girl's attackers . "
0,"it's difficult to imagine that a more confused , less interesting and more sloppily made film could possibly come down the road in 2002 . "
0,the type of dumbed-down exercise in stereotypes that gives the [teen comedy] genre a bad name . 
0,a waste of fearless purity in the acting craft . 
0,"neither as scary-funny as tremors nor demented-funny as starship troopers , the movie isn't tough to take as long as you've paid a matinee price . "
1,the film covers the life of young patricia ( jolie jackunas ) who longs for a career as a singer and songwriter . 
1,"in a last ditch effort to stop memnon from taking over the world , the leaders of the remaining free tribes hire the assassin mathayus to kill the sorceress . "
1,"in this cinematic concert , mesmerizing images are plucked from everyday reality , then visually altered with state-of-the-art digital techniques . "
1,"with edgaar's faithful servant , elmendorf , george sets out . "
0,"the movie is amateurish , but it's a minor treat . "
1,"the film captures intense footage of several art events as well as interviews with burning man organizers larry harvey ( also co-founder ) , crimson rose and will roger who explain how , what started in 1986 as an impromptu summer solstice celebration , put on by a few friends at a beach in san francisco , has turned into a full-blown exercise in city planning and management with a hefty price-tag . "
1,by the end of the girl's journey there is only one question to be answered : what is real and what is her imagination ? 
1,the council reluctantly admits that they are in a dire situation and they require blade's assistance . 
1,"chris , a radio dj , and his wife , katrin , who works at a truck stop , are friends with uwe , who owns a snack bar , and his wife , ellen , who sells perfume . "
0,the script was reportedly rewritten a dozen times -- either 11 times too many or else too few . 
0,arteta directs one of the best ensemble casts of the year
1,"behind its doors , an elderly husband and wife guard a secret so dark and complex , no one else has ever shared it . "
0,"austin powers in goldmember is a cinematic car wreck , a catastrophic collision of tastelessness and gall that nevertheless will leave fans clamoring for another ride . "
1,"from the creative mind of pulizter winner dave barry , comes a film following a chain of events inspired by the arrival of a mysterious suitcase in miami . "
0,"filled with alexandre desplat's haunting and sublime music , the movie completely transfixes the audience . "
0,"it just goes to show , an intelligent person isn't necessarily an admirable storyteller . "
1,"all that quickly changes when frodes father is going out with his new girlfriend mette , who hates children . "
0,"it's a bad sign when you're rooting for the film to hurry up and get to its subjects' deaths just so the documentary will be over , but it's indicative of how uncompelling the movie is unless it happens to cover your particular area of interest . "
0,a visual spectacle full of stunning images and effects . 
0,dawdles and drags when it should pop ; it doesn't even have the virtue of enough mindless violence to break up the tedium of all its generational bonding . 
1,former world-rallye-champion walter and his daughter natascha are kidnapped by arab terrorists and brought to berlin . 
0,intriguing documentary which is emotionally diluted by focusing on the story's least interesting subject . 
1,"a geo-political thriller where gerry anderson finds that sometimes , everybody really is out to get you . "
0,"it sounds like another clever if pointless excursion into the abyss , and that's more or less how it plays out . "
1,"in the vein of raiders of the lost ark , this action packed thriller takes us on a roller coaster ride from the bone chilling cold of moscow to the mystical beauty of india . "
0,"twohy is not only skilled at building and maintaining suspense , he's also aware that a cast chock full of experienced character actors is the right fit for a haunted sub flick . "
0,the story alone could force you to scratch a hole in your head . 
0,the problem is that the movie has no idea of it is serious or not . 
0,"an interesting psychological game of cat-and-mouse , three-dimensional characters and believable performances all add up to a satisfying crime drama . "
0,"a fascinating , unnerving examination of the delusions of one unstable man . "
1," "" all for nothin' "" is their story of love , forgiveness and redemption . "
1,"sensing that he has become but another mark for his mother to con , johnny flees with her money . "
1,the problem is that the mysterious inhabitants are murderous lunatics out to kill every one of them . . . 
1,"after three rowdy guys get booted from their frat house , they dress up as women and pledge the "" ugly girl "" sorority , where they figure they'll blend right in . "
1,"starry-eyed forest ranger , jackie , rescues the hunk of her dreams from a cliff side motorcycle accident . "
0,"although very much like the first movie based on j . k . rowling's phenomenal fantasy best sellers , this second go-round possesses a quite pleasing , headlong thrust and a likably delinquent attitude . "
0,"daringly perceptive , taut , piercing and feisty , biggie and tupac is undeniably subversive and involving in its bold presentation . "
1,"a documentary seven years in the making about women in the film business and how they balance , children , love lives and career--or how they don't . "
1,or does kip just want to destroy the planet ? 
0,"morton is a great actress portraying a complex character , but morvern callar grows less compelling the farther it meanders from its shocking start . "
0,the story and characters are nowhere near gripping enough . 
0,"interview with the assassin is structured less as a documentary and more as a found relic , and as such the film has a difficult time shaking its blair witch project real-time roots . "
0,"when your leading ladies are a couple of screen-eating dominatrixes like goldie hawn and susan sarandon at their raunchy best , even hokum goes down easily . "
0,the acting alone is worth the price of admission . 
0,"visually fascinating . . . an often intense character study about fathers and sons , loyalty and duty . "
0,the rare movie that's as crisp and to the point as the novel on which it's based . 
1,"otjen is helming the pic , holly mosher produces . "
1,"then the unthinkable happens : a nuclear bomb explodes in a u . s . city , and america is quick to blame the russians . "
0,manages to accomplish what few sequels can -- it equals the original and in some ways even betters it . 
0,"it's a decent glimpse into a time period , and an outcast , that is no longer accessible , but it doesn't necessarily shed more light on its subject than the popular predecessor . "
1,"an intense relationship drama that takes the form of a mystery , the event centers around a series of unexplained deaths that occur among the gay community in new york's fashionable chelsea district . "
0,"sheridan had a wonderful account to work from , but , curiously , he waters it down , turning grit and vulnerability into light reading . "
1,once you have walked into april's shower you can never leave . 
1,the end of the journey leaves no-one capable of going back to where they started from . 
1,"through an allegorical 'fable' that is told in parallel with joseph's struggle , we are left to decide for ourselves in the end , who is the crow and who is the wolf . , was someone out to get joseph , was it a stroke of bad luck , or was it all in his head ? "
0,"a gracefully acted , unsentimental , quite likable little coming-of-age movie . "
1,"as carolyn's "" perfect life "" falls apart , pumpkin teaches her that perfect isn't always perfect after all . "
0,"some movies were made for the big screen , some for the small screen , and some , like ballistic : ecks vs . sever , were made for the palm screen . "
1,two college grads land an entry level mafia job driving a retiring don's car cross country . 
0,"how do you make a movie with depth about a man who lacked any ? on the evidence before us , the answer is clear : not easily and , in the end , not well enough . "
1,they feel they are at the end of their rope and know they need a big stash of cash to make their musical dreams a reality . 
1,his story explores the ramifications of leaving afghanistan and living as a refugee in america . 
1,susie resorts to these to become the most beautiful woman in the world . 
0,"gives you the steady pulse of life in a beautiful city viewed through the eyes of a character who , in spite of tragic loss and increasing decrepitude , knows in his bones that he is one of the luckiest men alive . "
1,the young man find herbert down in his jail cell and learns for himself just what the re-agent is capable of . 
1,"torn between his father's dream of making a hospital ( which he can realize by marrying sonia ) and his own personal emotions for dr . neha , akash has to choose either . "
1,they spend their afternoons discussing theater and lucy's role as antigone in a school loneliness of the city more bearable . 
0,to portray modern women the way director davis has done is just unthinkable . 
0,"though not as tightly focused or as well-performed as malkovich , human nature has its own absurdist flair . "
1,things turn nasty when the casino director ( alec baldwin ) tries to break up the romance . 
0,"the chateau belongs to rudd , whose portrait of a therapy-dependent flakeball spouting french malapropisms . . . is a nonstop hoot . "
1,"she finds out that the truth about both her parents is very revealing , shocking at times , but comes to terms with her past . "
1,this film was shot during two trips that majid majidi took in western afghanistan in 2001 and 2002 . 
1,this undercover documentary takes you deep into the controversial arena of backyard wrestling where the limits are constantly being tested . . . and 
