label,data
0,"though the film is well-intentioned , one could rent the original and get the same love story and parable . "
0,"no dia em que aceitou dirigir esta continuação , harold ramis deve ter saído da cama com o pé esquerdo . e aqueles que decidiram assistir a este filme também . "
0,aimed squarely at the least demanding of demographic groups : very small children who will be delighted simply to spend more time with familiar cartoon characters . 
0,beautifully written and directed and packed with excellent performances . 
0,"has no reason to exist , other than to employ hollywood kids and people who owe favors to their famous parents . "
0,"clint eastwood's blood work is a lot like a well-made pb& j sandwich : familiar , fairly uneventful and boasting no real surprises  but still quite tasty and inviting all the same . "
0,"fans of plympton's shorts may marginally enjoy the film , but it is doubtful this listless feature will win him any new viewers . "
0,"the sweetest thing , a romantic comedy with outrageous tendencies , may be a mess in a lot of ways . but it does have one saving grace . a lot of its gags and observations reflect a woman's point-of-view . "
1,"chon lin follows rathbone to london to kill him , while sending chon a letter telling him of the murder . "
1,it would seem that nothing is capable of distracting scotty johns from working on his much-anticipated second book . 
0,"certainly not a good movie , but it wasn't horrible either . "
1,"uncompromising in his work , sullivan is just as devoted to his private life as an upstanding husband and father of two young boys . "
0,it's not as awful as some of the recent hollywood trip tripe . . . but it's far from a groundbreaking endeavor . 
1,"greg puts up with martha's harsh criticism in exchange for a place to lay-low until he can evade the police and repair his delicate relationship with his young daughter , chelsea . "
1,seeing these old cars in recent films and photographs one wonders how they have maintained them after decades with no spare parts and an embargo by the united states . 
0,"just one more collection of penis , breast and flatulence gags in search of a story . or a profit . or some damn thing . "
1,"she - pert , forward , a ball of fire - has just thrown her mobile away after an angry tete-a-tete with her ( ex- ) boyfriend . "
1,"this causes duncan's father ( jenkins ) further grief , who doesn't understand his son's unusual mourning rituals . "
0,"the best didacticism is one carried by a strong sense of humanism , and bertrand tavernier's oft-brilliant safe conduct ( "" laissez-passer "" ) wears its heart on its sleeve . "
0,"impresses as a skillfully assembled , highly polished and professional adaptation . . . just about as chilling and unsettling as 'manhunter' was . "
1,an action comedy prequel to spang olsen's box office hit in china they eat dogs . 
1,he then goes to paris where he prepares to make a political film criticizing the state of repression in his native land . 
0,"instead of trying to bust some blondes , [diggs] should be probing why a guy with his talent ended up in a movie this bad . "
1,"documentary-style drama showing the events that lead up to the tragic incident on january 30 , 1972 in the northern ireland town of derry when a protest march led by civil rights activist ivan cooper was fired upon by british troops , killing 13 protesters and wounding 14 more . "
0,"a time machine , a journey back to your childhood , when cares melted away in the dark theater , and films had the ability to mesmerize , astonish and entertain . "
0,all the well-meaningness in the world can't erase the fact that the believer feels like a 12-step program for the jewish nazi . 
1,"soon after , however , his ex loses her tv show , and comes back home , looking to reunite . "
0,"what's most memorable about circuit is that it's shot on digital video , whose tiny camera enables shafer to navigate spaces both large . . . and small . . . with considerable aplomb . "
0,"scooby doo is surely everything its fans are hoping it will be , and in that sense is a movie that deserves recommendation . "
0,"the holes in this film remain agape -- holes punched through by an inconsistent , meandering , and sometimes dry plot . "
0,all the movie's narrative gymnastics can't disguise the fact that it's inauthentic at its core and that its story just isn't worth telling . 
1,"she arrives with every intent of selling it all off and going back to her busy career , but in going through her grandmother's belongings , she discovers much about her family's past which ultimately makes her re-evaluate her life and values . "
0," . . . with "" the bourne identity "" we return to the more traditional action genre . "
0,"frustratingly , dridi tells us nothing about el gallo other than what emerges through his music . "
0,"the acting , costumes , music , cinematography and sound are all astounding given the production's austere locales . "
1,"upon one of his famous , hand-made tortillas appears the face of jesus christ . "
0,i walked away from this new version of e . t . just as i hoped i would -- with moist eyes . 
0,the title trapped turns out to be a pretty fair description of how you feel while you're watching this ultra-manipulative thriller . 
1,"terror at tate manor is an independent horror film set in a real haunted house , rich in ghost and spirit sightings , and quite active throughout the filming . "
1,"until she leaves to the kitchen and he finds out that under the bed a male shoe that does not belong to him is carefully hidden by a male hand , under his own eyes . "
1," "" cold mountain "" tells the story of a wounded confederate soldier named inman ( jude law ) who struggles on a perilous journey to get back home to cold mountain , n . c . as well as to ada ( nicole kidman ) , the woman he left behind before going off to fight in the civil war . "
0,i was sent a copyof this film to review on dvd . for free . i still want my money back . 
0,"the overall result is an intelligent , realistic portrayal of testing boundaries . "
0,"an occasionally funny , but overall limp , fish-out-of-water story . "
0,"a vile , incoherent mess . . . a scummy ripoff of david cronenberg's brilliant 'videodrome . '"
0,"i enjoyed "" formula 51 "" in a guilty kind of way"
0,"from the choppy editing to the annoying score to 'special effects' by way of replacing objects in a character's hands below the camera line , "" besotted "" is misbegotten"
1,the film centres around three female supermodels who live and work together . 
1,"michael , sr . and michael , jr . then set out to get revenge on the man who killed peter and mrs . sullivan . "
1,the trail is strewn with corpses and everything points to them as the killers . 
0,don't let the subtitles fool you ; the movie only proves that hollywood no longer has a monopoly on mindless action . 
0,about a boy will warm your heart without making you feel guilty about it . 
0,"without blowing the jokes we can say that , if you have found that your sense of humor fit well with christopher guest's screen outings , you'll find yourself in the flow with shearer as well . "
0,despite the surface attractions -- conrad l . hall's cinematography will likely be nominated for an oscar next year -- there's something impressive and yet lacking about everything . 
1,"lotte goes to live with her upper middle class dutch aunt in holland , anna to work as a farm hand on her german uncle's rural farm . "
0,"the best part about "" gangs "" was daniel day-lewis . "
0, . . . a rousing fantasy of bloodless revolution against capricious colonial rulers . 
1,"what they soon realize , though , is they are not alone in hypertime . "
0,nights feels more like a quickie tv special than a feature film . . . it's not even a tv special you'd bother watching past the second commercial break . 
0,"it might be 'easier' to watch on video at home , but that shouldn't stop die-hard french film connoisseurs from going out and enjoying the big-screen experience . "
0,"as david letterman and the onion have proven , the worst of tragedies can be fertile sources of humor , but lawrence has only a fleeting grasp of how to develop them . "
1,the future is on it's way to atlantic city on a bus . 
1,the deuces are determined to do whatever is necessary to keep drugs off their block even if that means dying . 
0,it's a lovely film with lovely performances by buy and accorsi . 
0," "" the best disney movie since the lion king "" "
1,the daughter mary yearns for a home where the books don't always get sold . 
1,"a year later , strange things start to happen , as each person that was connected to the hit and run incident is being killed . . . one "
1,"identified as deserters , they are returned to their barracks to be court martialed . "
1,"as the end of times approaches , an angel and a demon must team up to sort out the whole mess . . . "
0,"martha is rich in contradictions , her tightly wound personality running counter to the sensual pleasure she offers others through her art . "
1,nine year old brian billings has been diagnosed with an acute fear of the dark . 
0,"the film is exhilarating to watch because sandler , liberated from the constraints of formula , reveals unexpected depths as an actor . "
1,"the antichrist comes to earth as a newborn baby , but a nurse accidentally switches him with another newborn , and for eleven years he grows up as a normal child . "
1,"in the meantime , a grifter breaks into their apartments and rummages their personal belongings , thus unfolding hidden secrets . "
0,what might have been acceptable on the printed page of iles' book does not translate well to the screen . 
1,"but after he's done his "" day job "" matt takes on a secret identity as "" the man without fear , "" daredevil , the masked avenger that patrols the neighborhood of hell's kitchen and new york city to combat the injustice that he cannot tackle in the courtroom . "
1,the story begins with the discovery that otte's visa is being withheld by the ghana embassy in holland due to a controversy in the press . 
0,no amount of good intentions is able to overcome the triviality of the story . 
1,after the great success of the ring hollywood decided to take another swing at bringing another japanese film to the rest of us . 
0,"pc stability notwithstanding , the film suffers from a simplistic narrative and a pat , fairy-tale conclusion . "
0,"there's no mistaking the fact that this hybrid misses the impact of the disney classic , and even that of the excellent 1934 mgm version . "
0,the entire movie is in need of a scented bath . 
0,"the aaa of action , xxx is a blast of adrenalin , rated eee for excitement . and vin diesel is the man . "
1,they say sooner or later all love stories will end ; now &#38 ; forever is the exception . . . 
0,"son of the bride is slight fare , but it does have it poignancies , and it is well-acted and sweet without being cloying . "
0,speaks eloquently about the symbiotic relationship between art and life . 
0,"chicago offers much colorful eye candy , including the spectacle of gere in his dancing shoes , hoofing and crooning with the best of them . "
1,"by the time their power struggle is finally resolved , both bob and the assistant learn that neither one of them is really in charge . "
0," "" the emperor's new clothes "" begins with a simple plan . . . . well , at least that's the plan . "
1,when all but one of mi5's top agents are killed in an explosion . 
0,"an unsatisfying hybrid of blair witch and typical stalk-and-slash fare , where the most conservative protagonist is always the last one living . "
0,the story the movie tells is of brian de palma's addiction to the junk-calorie suspense tropes that have all but ruined his career . 
1,"when the chemical sisters , montreal's fabulous club kid duo find an unconscious naked boy on their way out from yet another jetset event , they decide to bring him home and take matters into their own glittery hands . "
1,"the truly independent film , the after school special , was a simple story that said so much and touched people in so many ways . "
0,"no , the dangerous lives of altar boys does not exist in a state of perfect grace . however , its sins are forgivably venial , because its virtues are palpably human . "
1,"they fight with glass plates , staple guns , light bulbs , fire and other homemade weapons . "
1,"the issue at hand is animal testing , which elle becomes concerned about when the parents of her dog can't attend the pet's wedding because of it . "
0,"ensemble movies , like soap operas , depend on empathy . if there ain't none , you have a problem . "
1,yan tells lynn he loves her and wants to marry her . 
0,the acting is fine but the script is about as interesting as a recording of conversations at the wal-mart checkout line . 
0,perhaps no greater example yet exists of the beauty achievable when one is a master of the digital aesthetic . 
1,"former maintenance man gary fitch becomes the least likely candidate for mayor of santa monica , california , when he teams up with the wackiest "" dream-team "" imaginable : glory , a former high-priced call-girl ; his homeless buddy foster edwards , iii ; and shane martinez , a gay delivery boy . "
0,"a gorgeous , high-spirited musical from india that exquisitely blends music , dance , song , and high drama . "
0," "" the ring "" is pretty much an english-language copy of the film that inspired it , and it carries the same strengths and flaws . "
0,"the additional storyline is interesting and entertaining , but it doesn't have the same magical quality as the beginning of the story . i like the new footage and still love the old stuff . "
1,"paramount to her world is gene , a wealthy disturbed businessman who has slowly become her benefactor over the years . "
0,"there's a scientific law to be discerned here that producers would be well to heed : mediocre movies start to drag as soon as the action speeds up ; when the explosions start , they fall to pieces . "
1,"she quickly makes friends with paul taylor , a witty mormon student filmmaker who finds jenny's ambitious dream to be the subject for his next film project . "
1,"one day there is an ordinary row in the local saloon , but one of the trouble makers , called prosit , shows up to be baron werner amadeus von luckner . "
1,"along comes sonja , who wants to know how the horny tale he's now working on will end . "
0,"kung pow is oedekerk's realization of his childhood dream to be in a martial-arts flick , and proves that sometimes the dreams of youth should remain just that . "
1,"the interviewees , who represent diverse relationships to and perspectives on marriage , use their own stories to explain why the filmmakers - long-term partners interested in starting a family - should or should not wed . "
1,"two angels realize that the babies have been switched , and decide to try and find the antichrist and prevent the end of the world . "
0,dripping with cliche and bypassing no opportunity to trivialize the material . 
1,"'tracks' chronicles their descent with a striking visual portrayal of a boy who made a mistake , paid the consequences and got back on 'track . ' "
1,"after ten years of being ignored by record producers , jacki and the band find hope in one producer who promises to see them play and consider them for a contract . "
0,"a b-movie you can sit through , enjoy on a certain level and then forget . "
0,unfolds in a series of achronological vignettes whose cumulative effect is chilling . 
1,"both got stuck in a broken elevator , 17 level above ground . "
1,"set in the los angeles police department in april 1992 , dark blue is a dramatic thriller that takes place just days before the acquittal of four white officers in the beating of black motorist rodney king and the subsequent l . a . riots . "
1,"with utter certainty that druden is the one from butcher's vision , inez plans their escape to richmond . "
0,"the most memorable moment was when green threw medical equipment at a window ; not because it was particularly funny , but because i had a serious urge to grab the old lady at the end of my aisle's walker and toss it at the screen in frustration . "
0,bears is even worse than i imagined a movie ever could be . 
1,"mr . stiles has an ulterior motive however , and has enlisted possum lake's sheriff ( darren frost ) and deputy ( melissa dimarco ) to help prevent the lodge from coming up with money to pay the fine . "
0,"what really makes it special is that it pulls us into its world , gives us a hero whose suffering and triumphs we can share , surrounds him with interesting characters and sends us out of the theater feeling we've shared a great adventure . "
0,the leads we are given here are simply too bland to be interesting . 
1,he is intelligent and has a sense of humour . 
0,most of the things that made the original men in black such a pleasure are still there . 
0,"sheridan is painfully bad , a fourth-rate jim carrey who doesn't understand the difference between dumb fun and just plain dumb . "
0,"i wish windtalkers had had more faith in the dramatic potential of this true story . this would have been better than the fiction it has concocted , and there still could have been room for the war scenes . "
0,"preposterous and tedious , sonny is spiked with unintentional laughter that , unfortunately , occurs too infrequently to make the film even a guilty pleasure . "
0,"feels aimless for much of its running time , until late in the film when a tidal wave of plot arrives , leaving questions in its wake . "
0,nothing more than an amiable but unfocused bagatelle that plays like a loosely-connected string of acting-workshop exercises . 
1,"however , when one of the lads accidentally shags a punter ( steven berkoff ) to death , they are forced to look for 'work' elsewhere . "
1,"some of the featured art events include "" burial in space "" by woodpussy ( a group of musicians and pyro-technicians who blast their deceased founder into space in a rocket of their own creation ) ; "" nebulous entity "" and "" futura deluxe "" ( two large , roving installation pieces engineered using mathematics derived from fields of neural networks , ecological systems and fractals ) ; and a performance artist dea million who stages her "" wedding "" to america . "
0,"its message has merit and , in the hands of a brutally honest individual like prophet jack , might have made a point or two regarding life . "
1,"one horrible night , kimberly mathews , a random girl from the nearby town , wanders too close to willy's territory . "
1,"but when it comes down to it , the one thing stopping you from living your dreams is you . "
0,"the film is a hoot , and is just as good , if not better than much of what's on saturday morning tv especially the pseudo-educational stuff we all can't stand . "
1,"using this violence as a springboard , bret begins a new game , a game where only he knows the rules . "
0,"watching living actors interact against the lush , studied inertia of the backdrops gives us the impression of history come to life , or statues magically transformed into living creatures . "
1,"while introducing his film mockery , he receives a phone call from his producer lying in intensive care at a hospital . "
1,"ben's rock-solid , promising future and romance with amy are turned upside-down with the arrival of madison bell . "
1,the decisions he makes when confronted with this new truth will affect him forever . 
0,the ill-conceived modern-day ending falls flat where it should deliver a moral punch . 
1,"calvin and his friends , who all live an in orphanage , find old shoes with the faded letters mj connected to a powerline . "
1,"as well , another priest in the diocese , father natalio , is suspected of assisting guerilla troops in the highlands . "
0,"this little film is so slovenly done , so primitive in technique , that it can't really be called animation . "
1,"winslow had abandoned the experiments long ago , however ex-patient/caretaker , "" ernst "" ( michael zelnicker ) has developed a symbiotic , telepathic relationship with the rodents , and they thrive off of each other . "
1,"the corrupt wizard saruman ( christopher lee ) , under the power of the dark lord sauron , and his slimy assistant , gr&#237 ; ma wormtongue ( brad dourif ) , have created a grand uruk-hai army bent on the destruction of man and middle-earth . "
1,together they discover that a corporation funds and is profitting from the plantation-like work environment they are forced to work under . 
0,"solid . isn't as groundbreaking as shiri , but has its moments . "
1,"every member of the pecking order sees the dupe as the new low man on the totem pole , and as a result , the perfect tool to boost themselves towards the top of this dysfunctional hierarchy . "
1,when she was a little child she was given up for adoption and now she is ready to discover the story of her life . 
0,"there's no emotional pulse to solaris . with an emotional sterility to match its outer space setting , soderbergh's spectacular swing for the fence yields only a spectacular whiff . "
1,thirty years ago he was a poor worker who left his girlfriend to pursuit his dream of success . 
0,"a spiritual exploration of sorts , offering a message of hope that resonates . "
1,"the 57-minute , color documentary feature film , wedding advice : speak now or forever hold your peace , explores contemporary american ambivalence about weddings and marriage . "
1,"west has now identified an electrical phenomenon # the nee # which is discharged from the brain at the moment of death . . . and which may be the 'missing link' in his studies : if the nee is re-injected into a re-animated corpse , it should restore the 'subject' to full 'reason' . . . "
0,this movie in a single breath goes to the very heart of the russian experience . 
0,"a worthy addition to the cinematic canon , which , at last count , numbered 52 different versions . "
1,"at the height of hitler's infamous u-boat war , the crew of the u . s . s . "
1,women craved him and men wanted to be him . 
1,mason novel follows a british officer who resigns his post right before his regiment ships out to battle the rebels . 
0,this is christmas future for a lot of baby boomers . 
1,he blows her off at every opportunity to cuddle with flight attendants . 
1,"but when a tragedy strikes anakin's life , he begins slipping away from the light side of the force , and perhaps from the force itself . "
1,they grow hesitantly closer than their previous adversarial relationship as old bonds are tested and new awarenesses are inspired . 
0,"what's the most positive thing that can be said about the new rob schneider vehicle ? well , it's not as pathetic as the animal . "
0,"that storytelling has value cannot be denied . not even solondz's thirst for controversy , sketchy characters and immature provocations can fully succeed at cheapening it . "
0,"who needs mind-bending drugs when they can see this , the final part of the 'qatsi' trilogy , directed by godfrey reggio , with music by philip glass ? "
0,"vera has created a provocative , absorbing drama that reveals the curse of a self-hatred instilled by rigid social mores . "
0,"bears resemblance to , and shares the weaknesses of , too many recent action-fantasy extravaganzas in which special effects overpower cogent story-telling and visual clarity during the big action sequences . "
0,"where tom green stages his gags as assaults on america's knee-jerk moral sanctimony , jackass lacks aspirations of social upheaval . "
0,"even if it is generally amusing from time to time , i spy has all the same problems the majority of action comedies have . "
0,"a sham construct based on theory , sleight-of-hand , and ill-wrought hypothesis . "
1,she's not disappointed - oliver turns out to be a nightmare . 
0, . . . its stupidities wind up sticking in one's mind a lot more than the cool bits . 
0,"ultimately , the message of trouble every day seems to be that all sexual desire disrupts life's stasis . "
1,and finds himself in the middle of two assassination plots masterminded by the cia . 
1,club le monde follows an evening out at a seedy nightspot . 
1,"ultimately , quinn rescues tasha from the hands of another assassin and takes her into his protection . "
1,"they fool around for a while , but forget to get each other's names down at the end of the night . "
0,"i'm convinced i could keep a family of five blind , crippled , amish people alive in this situation better than these british soldiers do at keeping themselves kicking . "
1,"but someone breaks the link before they have finished and now a demon is trapped in their world and the only way to banish it , is for all the people who summoned it to die . "
1,witt plays a young harvard graduate who also represents grant's character . 
1,"while shooting an engagement party , he attempts to make a connection with jen , the beautiful sister of the bride . "
1,"ultimately , it is harold who timidly suggests participating in the upcoming duct tape festival in minneapolis-st . "
1,"it's steps , a film that draws its inspiration from the marx brother to monty python and it was done on such a shoe-string budget , it would make a studio executive blush . "
1,and that's the trick-it's a gay cruise-liner for gay men to make out . 
0,we get some truly unique character studies and a cross-section of americana that hollywood couldn't possibly fictionalize and be believed . 
0,"a zippy , enormously entertaining heist movie that , with a kind heart at its core , encompasses the styles of yesterday , today , and if we're lucky , maybe even tomorrow . "
0,a dream cast of solid female talent who build a seamless ensemble . there isn't a weak or careless performance amongst them . 
